{
  "instances": {
    "split_a": { "family": "rsfq", "cell": "SPLIT", "bias_domain": "b" },
    "split_b": { "family": "rsfq", "cell": "SPLIT", "bias_domain": "b" },
    "split_xor": { "family": "rsfq", "cell": "SPLIT", "bias_domain": "b" },
    "split_cin": { "family": "rsfq", "cell": "SPLIT", "bias_domain": "b" },
    "xor_ab": { "family": "rsfq", "cell": "XOR", "bias_domain": "b" },
    "and_ab": { "family": "rsfq", "cell": "AND", "bias_domain": "b" },
    "dff_cin": { "family": "rsfq", "cell": "DFF", "bias_domain": "b" },
    "xor_sum": { "family": "rsfq", "cell": "XOR", "bias_domain": "b" },
    "and_cin": { "family": "rsfq", "cell": "AND", "bias_domain": "b" },
    "dff_and": { "family": "rsfq", "cell": "DFF", "bias_domain": "b" },
    "or_cout": { "family": "rsfq", "cell": "OR", "bias_domain": "b" },
    "dff_sum": { "family": "rsfq", "cell": "DFF", "bias_domain": "b" },
    "c0": { "family": "rsfq", "cell": "SPLIT", "bias_domain": "b" },
    "c1": { "family": "rsfq", "cell": "SPLIT", "bias_domain": "b" },
    "c2": { "family": "rsfq", "cell": "SPLIT", "bias_domain": "b" },
    "c3": { "family": "rsfq", "cell": "SPLIT", "bias_domain": "b" },
    "c4": { "family": "rsfq", "cell": "SPLIT", "bias_domain": "b" },
    "c5": { "family": "rsfq", "cell": "SPLIT", "bias_domain": "b" },
    "c6": { "family": "rsfq", "cell": "SPLIT", "bias_domain": "b" }
  },
  "nets": [
    { "driver": { "port": "a" }, "sink": { "instance": "split_a", "port": "a" }, "wire": { "kind": "direct" } },
    { "driver": { "port": "b" }, "sink": { "instance": "split_b", "port": "a" }, "wire": { "kind": "direct" } },
    { "driver": { "port": "cin" }, "sink": { "instance": "dff_cin", "port": "a" }, "wire": { "kind": "direct" } },
    { "driver": { "port": "clk" }, "sink": { "instance": "c0", "port": "a" }, "wire": { "kind": "direct" } },
    { "driver": { "instance": "split_a", "port": "q0" }, "sink": { "instance": "xor_ab", "port": "a" }, "wire": { "kind": "direct" } },
    { "driver": { "instance": "split_a", "port": "q1" }, "sink": { "instance": "and_ab", "port": "a" }, "wire": { "kind": "direct" } },
    { "driver": { "instance": "split_b", "port": "q0" }, "sink": { "instance": "xor_ab", "port": "b" }, "wire": { "kind": "direct" } },
    { "driver": { "instance": "split_b", "port": "q1" }, "sink": { "instance": "and_ab", "port": "b" }, "wire": { "kind": "direct" } },
    { "driver": { "instance": "xor_ab", "port": "q" }, "sink": { "instance": "split_xor", "port": "a" }, "wire": { "kind": "direct" } },
    { "driver": { "instance": "split_xor", "port": "q0" }, "sink": { "instance": "xor_sum", "port": "a" }, "wire": { "kind": "direct" } },
    { "driver": { "instance": "split_xor", "port": "q1" }, "sink": { "instance": "and_cin", "port": "a" }, "wire": { "kind": "direct" } },
    { "driver": { "instance": "dff_cin", "port": "q" }, "sink": { "instance": "split_cin", "port": "a" }, "wire": { "kind": "direct" } },
    { "driver": { "instance": "split_cin", "port": "q0" }, "sink": { "instance": "xor_sum", "port": "b" }, "wire": { "kind": "direct" } },
    { "driver": { "instance": "split_cin", "port": "q1" }, "sink": { "instance": "and_cin", "port": "b" }, "wire": { "kind": "direct" } },
    { "driver": { "instance": "and_ab", "port": "q" }, "sink": { "instance": "dff_and", "port": "a" }, "wire": { "kind": "direct" } },
    { "driver": { "instance": "xor_sum", "port": "q" }, "sink": { "instance": "dff_sum", "port": "a" }, "wire": { "kind": "direct" } },
    { "driver": { "instance": "and_cin", "port": "q" }, "sink": { "instance": "or_cout", "port": "a" }, "wire": { "kind": "direct" } },
    { "driver": { "instance": "dff_and", "port": "q" }, "sink": { "instance": "or_cout", "port": "b" }, "wire": { "kind": "direct" } },
    { "driver": { "instance": "dff_sum", "port": "q" }, "sink": { "port": "sum" }, "wire": { "kind": "direct" } },
    { "driver": { "instance": "or_cout", "port": "q" }, "sink": { "port": "cout" }, "wire": { "kind": "direct" } },
    { "driver": { "instance": "c0", "port": "q0" }, "sink": { "instance": "c1", "port": "a" }, "wire": { "kind": "direct" } },
    { "driver": { "instance": "c0", "port": "q1" }, "sink": { "instance": "c2", "port": "a" }, "wire": { "kind": "direct" } },
    { "driver": { "instance": "c1", "port": "q0" }, "sink": { "instance": "c3", "port": "a" }, "wire": { "kind": "direct" } },
    { "driver": { "instance": "c1", "port": "q1" }, "sink": { "instance": "c4", "port": "a" }, "wire": { "kind": "direct" } },
    { "driver": { "instance": "c2", "port": "q0" }, "sink": { "instance": "c5", "port": "a" }, "wire": { "kind": "direct" } },
    { "driver": { "instance": "c2", "port": "q1" }, "sink": { "instance": "c6", "port": "a" }, "wire": { "kind": "direct" } },
    { "driver": { "instance": "c3", "port": "q0" }, "sink": { "instance": "xor_ab", "port": "clk" }, "wire": { "kind": "direct" } },
    { "driver": { "instance": "c3", "port": "q1" }, "sink": { "instance": "and_ab", "port": "clk" }, "wire": { "kind": "direct" } },
    { "driver": { "instance": "c4", "port": "q0" }, "sink": { "instance": "dff_cin", "port": "clk" }, "wire": { "kind": "direct" } },
    { "driver": { "instance": "c4", "port": "q1" }, "sink": { "instance": "xor_sum", "port": "clk" }, "wire": { "kind": "direct" } },
    { "driver": { "instance": "c5", "port": "q0" }, "sink": { "instance": "and_cin", "port": "clk" }, "wire": { "kind": "direct" } },
    { "driver": { "instance": "c5", "port": "q1" }, "sink": { "instance": "dff_and", "port": "clk" }, "wire": { "kind": "direct" } },
    { "driver": { "instance": "c6", "port": "q0" }, "sink": { "instance": "or_cout", "port": "clk" }, "wire": { "kind": "direct" } },
    { "driver": { "instance": "c6", "port": "q1" }, "sink": { "instance": "dff_sum", "port": "clk" }, "wire": { "kind": "direct" } }
  ],
  "ports": { "in": ["a", "b", "cin", "clk"], "out": ["sum", "cout"] },
  "clock_domains": {
    "clk": ["xor_ab", "and_ab", "dff_cin", "xor_sum", "and_cin", "dff_and", "or_cout", "dff_sum"]
  },
  "bias_domains": ["b"]
}
